eval_id	stage	status	mean_edge	incumbent_mean_edge	delta_vs_incumbent	strategy_name	label	description	snapshot_path
screen_0001	screen	seed	461.250395			LatentStateQuoteEngine	seed-from-apr08-screen460-1819-screen-0001	Fresh retained screen run seeded from the current Strategy.sol line after apr08-screen460-1819 saturated around small inventory-skew and burst-threshold probes.	artifacts/hill_climb/apr08-screen470-2222/snapshots/d70403f1a547994cba1c2530b420c6434657f3f6d5f9db0c1e32809161ec5eca.sol
screen_0002	screen	discard	461.653057	461.250395	0.402661	LatentStateQuoteEngine	quiet-recenter-benign-release-v2	Increase quiet-gap recentering on gap>=4 and gap>=5 while using calm-gated benign divergence release after reconvergence.	artifacts/hill_climb/apr08-screen470-2222/snapshots/7d962e7f3f6642cebcd8cac3f786055486bf22e48a189206ee0c400fb27901e8.sol
screen_0003	screen	discard	461.965207	461.250395	0.714812	LatentStateQuoteEngine	quiet-recenter-plus-selective-passive-v1	Layer selective quiet-reconvergence passive recapture on top of the stronger quiet-gap recenter ramp.	artifacts/hill_climb/apr08-screen470-2222/snapshots/c718a9dbb435bc5d66bf144a9dcf5fd62e7eadd039a89d5cd3b9407474518334.sol
screen_0004	screen	discard	461.832716	461.250395	0.582321	LatentStateQuoteEngine	quiet-recenter-plus-selective-passive-v2	Slightly raise long-gap selective passive recapture strength on top of the quiet benign-state composite line.	artifacts/hill_climb/apr08-screen470-2222/snapshots/063253e8e3fb4670bd2b76d25c7a0649211525d539d6ba1d279e8276e17effd1.sol
screen_0005	screen	discard	461.963632	461.250395	0.713237	LatentStateQuoteEngine	quiet-recenter-plus-selective-passive-v3	Differentiate long-gap selective passive recapture strength so only gap>=5 gets the stronger multiplier.	artifacts/hill_climb/apr08-screen470-2222/snapshots/4ad6db8cd6b5235ed27ebf0f6d74e27d544ceac28619578474fe09326ffe91ac.sol
screen_0006	screen	discard	462.098291	461.250395	0.847896	LatentStateQuoteEngine	quiet-recenter-plus-selective-passive-v4	Slightly soften only the longest-gap recenter step while keeping the best selective passive-recapture composite.	artifacts/hill_climb/apr08-screen470-2222/snapshots/0fa89aaa6f983e638df9f98d4483cfbfb072e205d7acb9dda688522cabb262e0.sol
screen_0007	screen	discard	445.451590	461.250395	-15.798805	LatentStateQuoteEngine	quiet-benign-plus-jump-memory-v1	Pivot from benign-state refinements by adding a fast clustered spot-jump memory that widens common spread modestly after short-gap jumps.	artifacts/hill_climb/apr08-screen470-2222/snapshots/5beb51c0dd73568d12cfb0d464ae81b90a7085998c7e3019ac4fd9088b6d69c8.sol
