eval_id	stage	status	mean_edge	incumbent_mean_edge	delta_vs_incumbent	strategy_name	label	description	snapshot_path
screen_0001	screen	seed	461.250395			LatentStateQuoteEngine	refined-seed-from-1813-screen-0003	Seed fresh retained screen run from the best raw refinement found under apr08-screen460-1813.	artifacts/hill_climb/apr08-screen460-1819/snapshots/d70403f1a547994cba1c2530b420c6434657f3f6d5f9db0c1e32809161ec5eca.sol
screen_0002	screen	discard	461.245311	461.250395	-0.005084	LatentStateQuoteEngine	deadbanded-inventory-skew-v1	Add a reservation-style deadbanded inventory skew from divergence memory and recent price change on top of the current directional burst line.	artifacts/hill_climb/apr08-screen460-1819/snapshots/30b331bc38758320e94ad50299690b86d137624939cf65703e27b43ca0b3bb46.sol
screen_0003	screen	discard	461.245049	461.250395	-0.005346	LatentStateQuoteEngine	gated-inventory-skew-v2	Keep the deadbanded toxic-side inventory skew, but shrink and gate the rebalancing-side relief by the existing opportunity gate.	artifacts/hill_climb/apr08-screen460-1819/snapshots/c595afc24d115ada12ea6155fd0e339dd98409f080507dba13d9068839073d6d.sol
screen_0004	screen	discard	461.244799	461.250395	-0.005596	LatentStateQuoteEngine	toxic-only-inventory-skew-v3	Keep only a smaller toxic-side inventory surcharge and remove the extra rebalancing-side relief.	artifacts/hill_climb/apr08-screen460-1819/snapshots/f4b28b9464d555b7289286896366a6f8d7fe0cbe8cae6cd381775014ec77ee42.sol
screen_0005	screen	discard	461.214737	461.250395	-0.035658	LatentStateQuoteEngine	divergence-to-toxic-reallocation-v1	Reduce common divergence carry and reallocate part of it into a deadbanded toxic-side skew.	artifacts/hill_climb/apr08-screen460-1819/snapshots/0df8bf956fa547dcee684e0d9c588224e969e23c6e1ecbcc3adc697ee1e5cae6.sol
screen_0006	screen	discard	461.103559	461.250395	-0.146836	LatentStateQuoteEngine	higher-burst-threshold-v1	Raise the above-threshold burst trigger from 8 to 10 bps so moderate events stay closer to the normal regime.	artifacts/hill_climb/apr08-screen460-1819/snapshots/14cdd2fd4b3860264ece7b2c82a381c28a98e975c349547e407d9f2018a90db9.sol
screen_0007	screen	discard	461.230292	461.250395	-0.020103	LatentStateQuoteEngine	shared-flow-deadband-v1	Add a deadband to the shared one-sided flow carry so mild imbalance stays in the normal common-fee regime.	artifacts/hill_climb/apr08-screen460-1819/snapshots/a6ed1e9846d15efb52e8dd9cad4c710b2415df16420b5a718a6f6799f49d5ea7.sol
screen_0008	screen	discard	461.234651	461.250395	-0.015744	LatentStateQuoteEngine	ultraquiet-fixed-rebate-v1	Add a strict fixed rebate only in clearly calm regimes after longer quiet gaps.	artifacts/hill_climb/apr08-screen460-1819/snapshots/b10cf8c1774e1f35cda7cf8cc2b64be778e6ed06ae55dc99c237a4c456a09a2e.sol
screen_0009	screen	discard	461.222477	461.250395	-0.027918	LatentStateQuoteEngine	burst-regime-divergence-saturation-v1	Reduce common divergence carry only while the burst regime is active.	artifacts/hill_climb/apr08-screen460-1819/snapshots/73b6bdcfa7e09127888ba401c6557f0d7fa79c11acd1fde49fea40266d464347.sol
