eval_id	stage	status	mean_edge	incumbent_mean_edge	delta_vs_incumbent	strategy_name	label	description	snapshot_path
screen_0001	screen	seed	473.616393			LatentStateQuoteEngine	baseline-latent-toxic-v1	Fresh retained screen seed on current evaluator before new branch generation.	artifacts/hill_climb/apr12-screen480-1130/snapshots/ad6e03710c508578d0f8b64ac74a262503163569c2ad16c91e1a25677eda3af1.sol
prescreen_0002	prescreen	discard	477.333721			LatentStateQuoteEngine	local-refine-hysteresis-v1	First hysteretic passive-release refinement: continuation dampener plus two-step calm confirmation before full recapture spend.	artifacts/hill_climb/apr12-screen480-1130/snapshots/56d3c15ad047a7dda37903e2804041f84be1d44a8a8b2ac0f16ddc5e0785ac6a.sol
screen_0003	screen	discard	473.994481	473.616393	0.378087	LatentStateQuoteEngine	local-refine-hysteresis-v1	Screen the hysteretic passive-release refinement after prescreen showed stronger weak-slice means but a non-binding fee-jump guardrail miss.	artifacts/hill_climb/apr12-screen480-1130/snapshots/56d3c15ad047a7dda37903e2804041f84be1d44a8a8b2ac0f16ddc5e0785ac6a.sol
screen_0004	screen	discard	473.612203	473.616393	-0.004190	LatentStateQuoteEngine	local-refine-hysteresis-v2	Restore incumbent passive recapture baseline, keep continuation dampener, and limit hysteresis to additive calm-release overlays.	artifacts/hill_climb/apr12-screen480-1130/snapshots/fea1eb353eacc4b4dbbefc6d57ade91a84bb020f4485d33ecc62e9e13690192f.sol
prescreen_0005	prescreen	discard	476.279827			LatentStateQuoteEngine	anti-arb-toxicity-v1	Add a persistent toxic-side budget from dominant signed-flow persistence plus price-response agreement, and spend it only through the incumbent toxic-side routing.	artifacts/hill_climb/apr12-screen480-1130/snapshots/825bcb95c70e65b85e0e4b31b6733da2ddc7238c6bb4c5700bd345e40e8b6322.sol
screen_0006	screen	discard	473.518648	473.616393	-0.097746	LatentStateQuoteEngine	weak-slice-bucket-v1	Replace the incumbent calm shared rebate with a refillable weak-slice bucket that only fills during benign long-gap periods and drains hard after each use.	artifacts/hill_climb/apr12-screen480-1130/snapshots/c56680675f26d48fa32cf71b0b0d7743b031e92685bcd5174aa10c13231efd94.sol
screen_0007	screen	discard	473.616393	473.616393	0.000000	LatentStateQuoteEngine	weak-slice-bucket-v2	Keep the incumbent shared rebate, refill a smaller weak-slice bucket only in stricter benign long-gap states, and spend it only through the active side opportunity cut.	artifacts/hill_climb/apr12-screen480-1130/snapshots/7b885f09046177cde51ae4180db8677a68e8b6cbc0e6a5a4be848d2aa7f21e6f.sol
prescreen_0008	prescreen	discard	372.627276			LatentStateQuoteEngine	fee-discipline-slew-v1	Add previous-fee memory and a final-output asymmetric slew scheduler so protective fee increases can stay fast while calm-side relaxation is capped.	artifacts/hill_climb/apr12-screen480-1130/snapshots/5bf0e8622eb89c1ff92dc065aaffa88b548c6504732ac0c80c9282db06b67b0c.sol
prescreen_0009	prescreen	discard	286.876325			LatentStateQuoteEngine	structural-pivot-two-mode-v1	First structural pivot: replace the single additive quote map with competitive/protective fee maps blended by a hysteretic router with minimum dwell time.	artifacts/hill_climb/apr12-screen480-1130/snapshots/ea39d1f89dbc60c79bb2bfb43e03d8714f4c98178f3aa31c95050dcb23192bcf.sol
